{
  "contract": "1.0",
  "kind": "result",
  "requestId": "f73544fdaba65af6e6a55c5e146d8565b2e94185ba3154359ecda6f4a6ffd54f",
  "caseId": "0318018e2bf0d3700b9594802bda35d77b49a9451eba43d7ea4f87bb49d7f1f8",
  "engine": {
    "id": "fake",
    "fingerprint": "e7ac79d8f377c7751671d7211063119902939c1159379cd4c644218b90d5dc68",
    "details": {
      "version": "0.1.0",
      "threads": 1,
      "jit": false,
      "build": null
    }
  },
  "status": "unsupported",
  "unsupported": [
    {
      "code": "case-source",
      "item": "fixture",
      "message": "the engine answers only about cases of its own lenses"
    }
  ],
  "diagnostics": {
    "warnings": [],
    "counts": {}
  }
}
