{
  "contract": "1.0",
  "kind": "result",
  "requestId": "f73544fdaba65af6e6a55c5e146d8565b2e94185ba3154359ecda6f4a6ffd54f",
  "caseId": "0318018e2bf0d3700b9594802bda35d77b49a9451eba43d7ea4f87bb49d7f1f8",
  "engine": {
    "id": "bench",
    "fingerprint": "operator-run 2",
    "details": {}
  },
  "status": "pending",
  "diagnostics": {
    "warnings": [],
    "counts": {}
  }
}
